{
  "$schema": "../../schemas/designer.setting-definition.schema.json",
  "schemaVersion": 1,
  "id": "stock.workflow-heading",
  "host": "designer",
  "slot": "essentials.options",
  "order": 20,
  "field": {"id": "canvas.workflowListName", "type": "string", "control": "stock.text",
    "label": "Workflow header", "description": "Optional heading of up to 80 characters for the workflow list. Leave blank to use Workflows."},
  "generatedBinding": {"presentation": "text", "slot": "workflow.heading"}
}
