{
  "$schema": "../../schemas/external-designer.setting-definition.schema.json",
  "schemaVersion": 1,
  "id": "stock.dark-text",
  "host": "designer",
  "slot": "appearance.options",
  "order": 100,
  "field": {"id": "canvas.textDark", "type": "string", "control": "stock.text",
    "label": "Dark text", "description": "Optional main text color, with or without #. Leave blank for the default."}
}
