{
  "$schema": "../../schemas/designer.setting-definition.schema.json",
  "schemaVersion": 1,
  "id": "stock.show-setup",
  "host": "designer",
  "slot": "essentials.options",
  "order": 40,
  "field": {
    "id": "setup.show",
    "type": "boolean",
    "control": "stock.checkbox",
    "default": false,
    "label": "Show setup",
    "description": "Show a setup-only view until the project and workflow runtime packages are ready."
  }
}
