{
  "$schema": "../../schemas/designer.setting-definition.schema.json",
  "schemaVersion": 1,
  "id": "stock.description",
  "host": "designer",
  "slot": "essentials.options",
  "order": 10,
  "field": {"id": "canvas.description", "type": "string", "control": "stock.text",
    "label": "Description"},
  "generatedBinding": {"presentation": "text", "slot": "workflow.description"}
}
