{
  "$schema": "../../schemas/external-designer.setting-definition.schema.json",
  "schemaVersion": 1,
  "id": "stock.dark-background",
  "host": "designer",
  "slot": "appearance.options",
  "order": 70,
  "field": {"id": "canvas.backgroundDark", "type": "string", "control": "stock.text",
    "label": "Dark page background", "description": "Optional six-digit hex color, with or without #. Leave blank for the default."}
}
