{
  "$schema": "../../schemas/external-designer.setting-definition.schema.json",
  "schemaVersion": 1,
  "id": "stock.light-secondary",
  "host": "designer",
  "slot": "appearance.options",
  "order": 40,
  "field": {"id": "canvas.secondaryLight", "type": "string", "control": "stock.text",
    "label": "Light secondary surface", "description": "Optional secondary panels and muted surface color, with or without #. Leave blank for the default."}
}
